{
  "schema_version": "0.3",
  "record_type": "memory_entry",
  "record_id": "record:memory:004",
  "created_at": "2026-01-13T00:00:00Z",
  "memory_id": "memory:procedure:stale",
  "topic_ref": "topic:synthetic-procedure",
  "scope": {
    "scope_type": "global",
    "environment_class": "document_review",
    "platform": "platform_neutral",
    "version_constraints": ["synthetic-v1"]
  },
  "conclusion_state": "active",
  "conclusion_summary": "An active conclusion with stale evidence requires review.",
  "source_refs": ["source:synthetic:stale"],
  "source_verification": {
    "status": "verified",
    "last_verified": "2025-01-01T00:00:00Z",
    "environment_class": "document_review",
    "method_refs": ["method:source-review:v1"]
  },
  "dedup_conflict_review": {
    "status": "clear",
    "duplicate_refs": [],
    "conflict_refs": [],
    "reason_codes": ["no_conflict_found"]
  },
  "promotion_review": {
    "status": "approved",
    "reviewer_type": "human",
    "reviewed_at": "2025-01-01T00:00:00Z",
    "reason_codes": ["source_was_current"]
  },
  "evidence_types": ["official_documentation"],
  "evidence_refs": ["evidence:synthetic:stale"],
  "evidence_state": "stale",
  "review_triggers": [
    {"trigger_type": "evidence_stale", "condition": "The supporting evidence is stale."}
  ],
  "relationships": {"supersedes": [], "superseded_by": [], "derived_from": ["source:synthetic:stale"], "related_knowledge_refs": []},
  "current_loading_allowed": false,
  "privacy": {"payload_handling": "synthetic_public", "sensitive_data_included": false},
  "authorization_effect": "none",
  "governance_effect": "none",
  "activation_state": "not_active"
}
