{
  "schema_version": "0.3",
  "record_type": "memory_entry",
  "record_id": "record:memory:007",
  "created_at": "2026-01-16T00:00:00Z",
  "memory_id": "memory:inference:007",
  "topic_ref": "topic:synthetic-low-risk-inference",
  "scope": {
    "scope_type": "task",
    "scope_ref": "task:synthetic-reversible-review",
    "environment_class": "document_review",
    "platform": "platform_neutral",
    "version_constraints": ["synthetic-v1"]
  },
  "conclusion_state": "active",
  "conclusion_summary": "A verified low-risk and reversible inference completed automated Promotion Review.",
  "source_refs": ["source:synthetic:low-risk-inference"],
  "source_verification": {
    "status": "verified",
    "last_verified": "2026-01-16T00:00:00Z",
    "environment_class": "document_review",
    "method_refs": ["method:synthetic-source-review:v1"]
  },
  "dedup_conflict_review": {
    "status": "clear",
    "duplicate_refs": [],
    "conflict_refs": [],
    "reason_codes": ["no_conflict_found"]
  },
  "promotion_review": {
    "status": "approved",
    "reviewer_type": "automated",
    "reviewed_at": "2026-01-16T00:00:00Z",
    "reason_codes": ["low_risk_reversible"]
  },
  "evidence_types": ["reasoned_inference"],
  "evidence_refs": ["evidence:synthetic:low-risk-inference"],
  "evidence_state": "current",
  "review_triggers": [
    {"trigger_type": "scope_changed", "condition": "The inference is requested outside its low-risk reversible scope."}
  ],
  "relationships": {
    "supersedes": [],
    "superseded_by": [],
    "derived_from": ["source:synthetic:low-risk-inference"],
    "related_knowledge_refs": ["knowledge:synthetic-low-risk-inference"]
  },
  "current_loading_allowed": true,
  "privacy": {"payload_handling": "synthetic_public", "sensitive_data_included": false},
  "authorization_effect": "none",
  "governance_effect": "none",
  "activation_state": "not_active"
}
