{
  "schema_version": "0.3",
  "record_type": "memory_entry",
  "record_id": "record:example:memory:002",
  "created_at": "2026-04-02T00:00:00Z",
  "memory_id": "memory:example:stale",
  "topic_ref": "topic:example-validator",
  "scope": {
    "scope_type": "global",
    "environment_class": "document_review",
    "platform": "platform_neutral",
    "version_constraints": ["example-v1"]
  },
  "conclusion_state": "active",
  "conclusion_summary": "A synthetic memory with stale evidence requires review.",
  "source_refs": ["source:example:memory:002"],
  "source_verification": {
    "status": "verified",
    "last_verified": "2025-04-02T00:00:00Z",
    "environment_class": "document_review",
    "method_refs": ["method:example-review:v1"]
  },
  "dedup_conflict_review": {
    "status": "clear",
    "duplicate_refs": [],
    "conflict_refs": [],
    "reason_codes": ["no_conflict_found"]
  },
  "promotion_review": {
    "status": "approved",
    "reviewer_type": "automated",
    "reviewed_at": "2025-04-02T00:00:00Z",
    "reason_codes": ["source_was_current"]
  },
  "evidence_types": ["official_documentation"],
  "evidence_refs": ["evidence:example:memory:stale"],
  "evidence_state": "stale",
  "review_triggers": [
    {"trigger_type": "evidence_stale", "condition": "The synthetic evidence is stale."}
  ],
  "relationships": {
    "supersedes": [],
    "superseded_by": [],
    "derived_from": ["source:example:memory:002"],
    "related_knowledge_refs": ["knowledge:example-validator"]
  },
  "current_loading_allowed": false,
  "privacy": {"payload_handling": "synthetic_public", "sensitive_data_included": false},
  "authorization_effect": "none",
  "governance_effect": "none",
  "activation_state": "not_active"
}
