{
  "schema_version": "0.3",
  "record_type": "memory_entry",
  "record_id": "record:memory:003",
  "created_at": "2026-01-12T00:00:00Z",
  "memory_id": "memory:procedure:old",
  "topic_ref": "topic:synthetic-procedure",
  "scope": {
    "scope_type": "global",
    "environment_class": "document_review",
    "platform": "platform_neutral",
    "version_constraints": ["synthetic-v0"]
  },
  "conclusion_state": "superseded",
  "conclusion_summary": "The previous synthetic procedure is retained for history.",
  "source_refs": ["source:synthetic:old"],
  "source_verification": {
    "status": "verified",
    "last_verified": "2026-01-01T00:00:00Z",
    "environment_class": "document_review",
    "method_refs": ["method:source-review:v1"]
  },
  "dedup_conflict_review": {
    "status": "merged",
    "duplicate_refs": ["memory:procedure:new"],
    "conflict_refs": [],
    "reason_codes": ["replacement_verified"]
  },
  "promotion_review": {
    "status": "approved",
    "reviewer_type": "human",
    "reviewed_at": "2026-01-12T00:00:00Z",
    "reason_codes": ["history_preserved"]
  },
  "evidence_types": ["official_documentation"],
  "evidence_refs": ["evidence:synthetic:old"],
  "evidence_state": "superseded",
  "review_triggers": [
    {"trigger_type": "replacement_available", "condition": "The replacement is withdrawn."}
  ],
  "relationships": {
    "supersedes": [],
    "superseded_by": ["memory:procedure:new"],
    "derived_from": ["source:synthetic:old"],
    "related_knowledge_refs": ["knowledge:synthetic-procedure"]
  },
  "current_loading_allowed": false,
  "privacy": {"payload_handling": "synthetic_public", "sensitive_data_included": false},
  "authorization_effect": "none",
  "governance_effect": "none",
  "activation_state": "not_active"
}
